27-01-2015,FCC to Marriott: Never try to block Wi-Fi again,Google Fiber expands to four more cities,Facebook blocks pages insulting Mohammed,Can Apple live up to the iHype?,NFL (officially) comes to YouTube,Microsoft sales soar for all its non-Windows products,,,,,,,Dec,-2.139746958,Down,0,1
28-01-2015,LA police chief claims Google's traffic app endangers cops,China crackdown makes it harder to get around the Great Firewall,,,,,,,,,,,Dec,-2.444628074,Down,0,1
29-01-2015,Tim Cook's Apple is hot. But can it keep going?,Stocks: 5 things to know before the open,,,,,,,,,,,Same,-0.066535376,Down,0,1
30-01-2015,US economy misses its mark at end of 2014,Stocks: 4 things to know before the open,Google's ad revenue continues to struggle,,,,,,,,,,Inc,3.617257682,Up,1,0
02-02-2015,Offshore corporate cash piles at risk from Obama tax plan,,,,,,,,,,,,Dec,-0.611217371,Down,0,1
03-02-2015,The 5 hottest ETFs in the world,Uber to develop self-driving cars,Geolocate your keys -- or your cat,FCC will seek heavier regulation of the Internet,,,,,,,,,Same,0.234848759,Up,1,0
04-02-2015,Twitter's CEO is on the hot seat,FCC chairman: Here's how I want to regulate the Internet,AT&T: We're going to sue the government,,,,,,,,,,Dec,-1.224394132,Down,0,1
05-02-2015,4 bad things Internet companies can't do anymore -- if the FCC gets its way,7 top stocks to buy in February,Red alert! 12 central banks cut rates this year,Coming soon: More Twitter in your Google,,,,,,,,,Inc,0.72356635,Up,1,0
06-02-2015,The New York Times and its big 'zero',Pilot in Brian Williams scandal: 'I am questioning my memories',Twitter still doesn't have as many users as Instagram,,,,,,,,,,Inc,0.636798403,Up,1,0
09-02-2015,Sling TV wants to shake up cable TV,In Boulder fear of a bigger Google,10 alternatives to Tinder,,,,,,,,,,Same,-0.032196665,Down,0,1
10-02-2015,Google's robot dog gets kicked around,Samsung says its eavesdropping TV works like Siri,Google wants you to kick this robot puppy,Israeli startup's unique cybercrime solution,Profitless IPOs are all the rage. Bubble alert?,,,,,,,,Inc,1.443407834,Up,1,0
11-02-2015,Google offers free 2 GB of storage after 'security checkup',Driverless car debuts on U.K. roads,,,,,,,,,,,Same,0.125161175,Up,1,0
12-02-2015,Elon Musk's 'insane' call: Tesla worth $700 billion,The car of the future,Facebook now lets you post when you're dead,Expedia to buy Orbitz in $1.6 billion deal,I lived without a cell phone for 135 days,,,,,,,,Inc,1.057226752,Up,1,0
13-02-2015,The View-Master is back. Now it's virtual reality for kids.,This company is making luxury jewelry with a 3-D printer,Chinese phone maker enters U.S. market with ... bunnies,,,,,,,,,,Inc,1.041686726,Up,1,0
17-02-2015,Nokia is paving the way for driverless cars,Inside the world of Apple's design guru Jony Ive,,,,,,,,,,,Dec,-0.729655651,Down,0,1
18-02-2015,The 2 reasons I'm dumping Amazon stock,,,,,,,,,,,,Dec,-0.313996652,Down,0,1
19-02-2015,Control everything with the tap of a button,,,,,,,,,,,,Inc,0.897703139,Up,1,0
20-02-2015,The Apple car: What we know,Why this tech party isn't like 1999,YouTube has a new app just for kids,,,,,,,,,,Dec,-0.769609831,Down,0,1
24-02-2015,Google bans porn from Blogger,Google Wallet to come pre-installed on Android phones,Kleiner Perkins trial puts spotlight on Silicon Valley gender issues,,,,,,,,,,Inc,1.14905109,Up,1,0
25-02-2015,You want the best flight deal? Google it,Apple ordered to pay $533 million in iTunes patent lawsuit,15 startups. One Silicon Valley bed and breakfast.,,,,,,,,,,Inc,1.48721992,Up,1,0
26-02-2015,The single best stock to own today,FCC adopts historic Internet rules,Google learns how to beat you at Atari video games,Revenge porn king wants a clean slate,What does net neutrality mean for you?,,,,,,,,Inc,2.258789683,Up,1,0
27-02-2015,Star Trek technology that we use today,Warren Buffett: How good is he?,Google allows porn on Blogger after backlash,This guy used a get-rich-quick scheme and got rich,,,,,,,,,Inc,0.750583812,Up,1,0
02-03-2015,11 stocks hedge funds and mutual funds love now,Google is becoming a wireless carrier,Boom! Nasdaq finally tops 5000 again,Google + is about to be broken up,This tiny card will give your smartphone 200 GB of storage,,,,,,,,Inc,1.928524025,Up,1,0
03-03-2015,Bad old U.S. policy causes 'FREAK' computer bug,Yahoo: 20 years of hits and flops,Nasdaq dogs: Cisco Sirius and Yahoo got left behind,Opinion: Wearables will explode after Apple Watch debut,,,,,,,,,Inc,0.559208487,Up,1,0
04-03-2015,Mark Zuckerberg has one rule for hiring,5 reasons Alibaba stock is tanking,Gmail contacts gets a much-needed update,The truth according to Google,,,,,,,,,Same,0.262302906,Up,1,0
05-03-2015,HBO without cable will reportedly cost $15 a month,,,,,,,,,,,,Same,0.053919146,Up,1,0
06-03-2015,Java now loads annoying adware on Macs,,,,,,,,,,,,Dec,-1.251558016,Down,0,1
11-03-2015,Step inside the world's first Google shop,Google CFO Patrick Pichette to retire enjoy 'midlife crisis of bliss and beauty',Google releases Calendar app for iPhone,,,,,,,,,,Dec,-0.713327576,Down,0,1
12-03-2015,New app offers free trading. Millennials jump in,,,,,,,,,,,,Inc,0.361334225,Up,1,0
13-03-2015,How Colombia went from murder capital to tech powerhouse,,,,,,,,,,,,Dec,-1.116520455,Down,0,1
16-03-2015,Microsoft wants to put Windows 10 inside robots ATMs and toasters,Scientology mounts media offensive against upcoming HBO documentary,,,,,,,,,,,Inc,0.646158758,Up,1,0
17-03-2015,Internet Explorer just won't die,Satya Nadella can see what every Microsoft employee is working on,Why I'm still bullish on U.S. stocks,Why one Ivy League grad turned down Amazon for a job in China,Uber CFO Brent Callinicos steps down,,,,,,,,Same,-0.157690887,Down,0,1
18-03-2015,Microsoft will let you unlock Windows 10 with your face,Britain hikes minimum wage by 3%,Apple and banks dismiss Apple Pay fraud worries,Google X exec: We need to fail faster,,,,,,,,,Inc,1.266964802,Up,1,0
19-03-2015,Sign up for CNNMoney's Market Madness!,The best advice for new investors,,,,,,,,,,,Same,-0.250271921,Down,0,1
20-03-2015,Magic Leap releases stunning holographic video,Branson: Virgin might make an electric car,Nasdaq near all-time high. Is it another bubble?,Tag Heuer enters the smartwatch market,Biased job ads: This startup has a fix,Google's new beautiful $1000 Web browser,Tag Heuer to make Google-powered smartwatch,Pornstar entrepreneurs find new homes on messaging apps,FAA allows Amazon to test drones in U.S.,Google abused its monopoly power FTC experts found,,,Same,-0.229672908,Down,0,1
23-03-2015,360-degree videos debut on YouTube,6 things about 'Becoming Steve Jobs',Millennials: You have an image problem,Wanted: Female entrepreneurs,,,,,,,,,Same,-0.289065761,Down,0,1
24-03-2015,Twitter is latest tech firm sued for sex discrimination,Google Fiber heading to Salt Lake City,NFL to try out live-streaming this fall,Verizon and AT&T-backed trade group sues government over net neutrality,Wall Street's most powerful woman jumps to Google,Send your texts 25 years into the future,San Francisco's luxury bus puts your commute to shame,,,,,,Inc,1.356302556,Up,1,0
25-03-2015,7 big changes coming to Facebook,China tries to rein in dancing grannies,Google could soon let you pay bills in Gmail,New Ford car automatically obeys speed limits,,,,,,,,,Dec,-2.053460911,Down,0,1
26-03-2015,Victoria's real secret: A 77-year old billionaire CEO,After Ruth Porat leaves who's Wall Street's top woman?,Finally! eBay puts more women on its board,An iPhone for people who hate Apple,Tennessee sues FCC over Internet law hurting one of its own cities: Chattanooga,,,,,,,,Dec,-0.43400751,Down,0,1
27-03-2015,Anti-email startup Slack got hacked,Google and Johnson & Johnson partner up for hi-tech surgery,Google names Ruth Porat its new CFO,The futuristic bed that locks the door brews coffee,Tech's highest paid women,Job interview? Beat the Millennial stereotype,For BlackBerry a surprise profit,Google's new CFO and her $70 million pay package,,,,,Dec,-0.842669951,Down,0,1
30-03-2015,Popular Google search: 'Why are gas prices so low?',America's best-performing female CEOs,,,,,,,,,,,Same,0.074330158,Up,1,0
31-03-2015,Google's new Chromebook is on a stick,,,,,,,,,,,,Dec,-0.363629039,Down,0,1
01-04-2015,The 32 best April Fools' Day gags of 2015,This is Microsoft's 'Spartan' browser that will replace Internet Explorer,,,,,,,,,,,Dec,-1.100987014,Down,0,1
02-04-2015,Looking for a job? Follow the money,Comcast to give Atlanta fastest Internet in the country,,,,,,,,,,,Dec,-0.983638746,Down,0,1
06-04-2015,6 top stocks to buy in April,,,,,,,,,,,,Inc,0.853973285,Up,1,0
07-04-2015,Google under fire for YouTube Kids app,Star Wars' films available for digital download for first time ever,,,,,,,,,,,Same,-0.196996784,Down,0,1
08-04-2015,This is the fastest cell phone network ever,You'll actually want to tap these smartphone ads,Psychiatrist wants patients to see his name in the New York Times,,,,,,,,,,Inc,0.599951473,Up,1,0
09-04-2015,Here's how to get a job at Google,Xiaomi sold 2 million smartphones in a single day,YouTube without ads? Yes for a price,Google wants to protect you from spoilers,,,,,,,,,Same,-0.046201512,Down,0,1
10-04-2015,BMW's 'Mini' to unveil augmented reality driving goggles in China,Google doesn't care where you went to college,,,,,,,,,,,Dec,-0.42043856,Down,0,1
13-04-2015,Pandora pops on Spotify fundraising report. Here's why.,,,,,,,,,,,,Same,0.14115981,Up,1,0
14-04-2015,Wall Street is a miserable place to work,,,,,,,,,,,,Dec,-1.092776433,Down,0,1
15-04-2015,How to invest $10,Google under siege: Europe wants blood,Stocks: 5 things to know before the open,,,,,,,,,,Inc,0.724411749,Up,1,0
16-04-2015,Is Barbie dead?,Surprise! 1 in 5 people use Bing,A better way to type on your smartphone,Why Netflix will have a tough time in China,,,,,,,,,Inc,0.735989165,Up,1,0
17-04-2015,MasterCard officially enters the order-ahead app game,Europe's antitrust chief takes on Google,,,,,,,,,,,Dec,-0.872017631,Down,0,1
20-04-2015,French lawmakers want Google to give up its secret search code,Elon Musk considered selling Tesla to Google : report,I'm a professional bridesmaid for hire,,,,,,,,,,Inc,1.860723868,Up,1,0
21-04-2015,Google search now favors mobile-friendly sites,Google's 'Mobilegeddon' - 5 Fast Facts,Google takes aim at Apple Watch with Android Wear updates,,,,,,,,,,Dec,-0.658590256,Down,0,1
22-04-2015,Google launches 'Project Fi' wireless service,Google invites more people to turn off its ads,Apple: Mac security flaw fixed. Expert: Wrong,Europe takes aim at Russia's mighty Gazprom,,,,,,,,,Inc,0.929075194,Up,1,0
23-04-2015,Love not war: Pentagon courts Silicon Valley,These CEOs work for 'free',Junk food's back! And 4 other things we've learned from earnings,Project Fi: Google's wireless service,The cell phone data scam,Stocks: 5 things to know before the open,,,,,,,Inc,1.109057452,Up,1,0
24-04-2015,Facetune makes your ugliest selfies look beautiful,Googlers freaked out when HR took away this perk,An Android robot is peeing on an Apple logo in Google Maps,Stocks: 6 things to know before the open,Amazon lifts curtain on secretive $5 billion cloud business,Google : Our mobile strategy isn't as bad as you think,Finally! Nasdaq tops its March 2000 record,,,,,,Same,-0.183712033,Down,0,1
27-04-2015,Facebook Messenger now lets you make video calls,Google wants to buy your invention,How high do you think the Nasdaq will go?,Nepal earthquake donations: Who's sending what,Google and Facebook help locate Nepal survivors,Nepal can't rebuild without the world's help,Google exec's girlfriend: He was magical,Revenge porn hacker: 'Scary how quickly I would drop my morals',Google exec killed in Nepal lived 'life based on happiness',To fight revenge porn I had to copyright my breasts,,,Dec,-1.423528956,Down,0,1
28-04-2015,Twitter earnings leaked ... on Twitter. Stock tanks 20%,Free rent: 7 World Trade Center opens doors to startups,What Apple could buy with its $193.5 billion cash,Where Hillary Clinton is smoking the GOP candidates: Facebook,Google took away this perk. Employees freaked out,BlackBerry would team with Apple on security,Martha Stewart professes her love for drones,,,,,,Same,-0.173089206,Down,0,1
29-04-2015,Microsoft Edge' will replace Internet Explorer,How to negotiate like a Wall Street banker,This code can hack nearly every credit card machine in the country,,,,,,,,,,Same,-0.252503147,Down,0,1
30-04-2015,With the first pick of the stock draft you select ...,The FBI is fighting a losing battle over phone snooping,Marissa Mayer docked $13 million and still made $42 million,$7.8 million to help college students find jobs,Secret' app shuts down and (surprise!) gives investors money back,,,,,,,,Dec,-1.92198297,Down,0,1
01-05-2015,10 things you'll love about Windows 10,U.S. and UK: Best business buddies?,Stock rout: Dow 2015 gains almost wiped out,,,,,,,,,,Same,-0.098428581,Down,0,1
04-05-2015,Ouch! CarlyFiorina.org shows her layoffs at HP,,,,,,,,,,,,Inc,0.417804,Up,1,0
05-05-2015,Most Googled jobs in 2015,Is McDonald's next in line for Europe tax probe?,,,,,,,,,,,Dec,-1.376792274,Down,0,1
06-05-2015,The top internships everyone is looking for,Marissa Mayer's worst nightmare is becoming reality,Europe dreams of closing digital gap with the U.S.,California: The nation's most unequal state,,,,,,,,,Dec,-1.32144024,Down,0,1
07-05-2015,Google commits $150 million to diversity,,,,,,,,,,,,Inc,1.280563012,Up,1,0
08-05-2015,The rich people dating app wants to buy city name,Here's why Uber may pay more than $3 billion for Nokia's maps,Here's what your favorite websites looked like 20 years ago,Fitbit files for an IPO,,,,,,,,,Same,0.29254578,Up,1,0
11-05-2015,Google Maps shuts down editing after 'robot peeing' incident,Uber may now be worth $50 billion. Really?,These 5 tech companies are sitting on $430 billion in cash,,,,,,,,,,Dec,-0.4959383,Down,0,1
12-05-2015,$9 computer raises $1M on Kickstarter,Verizon wants to eat Google's and Facebook's lunch,You've got merger! Verizon scoops up AOL,,,,,,,,,,Dec,-0.481564732,Down,0,1
13-05-2015,Woman fired after disabling GPS on work phone,Google : Human drivers are the problem,,,,,,,,,,,Same,-0.177171857,Down,0,1
14-05-2015,Apple BlackBerry Yelp Yahoo,Psst. Did you hear about Apple and BlackBerry?,,,,,,,,,,,Inc,0.867415521,Up,1,0
15-05-2015,Google's new self-driving cars hit the road,Avon's sad tale: An American icon in decline,,,,,,,,,,,Dec,-0.988541316,Down,0,1
18-05-2015,Linkin Park: Rock band by night venture capitalists by day,,,,,,,,,,,,Same,0.054506117,Up,1,0
19-05-2015,YouTube under fire for adult content in kids app,Top 10 best cities for jobs,Apple and Google to Obama: Hands off our phones!,Google is looking for a new Doodler,,,,,,,,,Inc,0.632983469,Up,1,0
20-05-2015,Now it's even easier to watch illegal movie streams,Remember Real from the '90s? It's back!,World's hottest luxury housing markets,,,,,,,,,,Same,0.14485506,Up,1,0
21-05-2015,Massive Clinton-era Internet bug shows pitfalls of Obama's 'backdoor' proposal,YouTube gets more lifelike,Google Maps fixing its N-word problem,,,,,,,,,,Inc,0.847662031,Up,1,0
22-05-2015,I'll only invest in startups with female founders,She's $10M closer to replacing plastic bottles,Adult dating site hack exposes sexual secrets of millions,Google Maps fixes N-word problem for most users,Selling your Android phone? Don't. It keeps your data.,,,,,,,,Same,-0.00741257,Down,0,1
26-05-2015,What I wish I knew about money on graduation day,,,,,,,,,,,,Dec,-1.077824287,Down,0,1
27-05-2015,Hear this: Apple announcements coming June 8,The 10 most valuable global brands,,,,,,,,,,,Inc,1.31193509,Up,1,0
28-05-2015,Google announces big mobile updates,Obama's favorite wearable company gets sued,GoPro unveils virtual reality camera,Consumers tell banks: Protect our data or else!,Stocks: 5 things to know before the open,iPhones and Androids to hit the road in GM cars,,,,,,,Inc,0.328993693,Up,1,0
29-05-2015,Apple is about to make your iPhone a lot cooler,Google's amazing new app is like Gmail for your Photos,Google I/O 2015 highlights,Google Cardboard teams with GoPro on virtual reality,Want an Oculus? It's gonna cost ya,,,,,,,,Dec,-0.978843264,Down,0,1
01-06-2015,FBI wants to make smartphones less safe say Congressmen,Woo hoo hoo! Former Google exec wants to turn around Vonage,Will a magnet really destroy your smartphone or hard drive?,,,,,,,,,,Dec,-0.521617041,Down,0,1
02-06-2015,Google : Still mostly white men work for us,Google keeps audio records of your 'OK Google ' requests,The global tax system is broken says Nobel prize winner,,,,,,,,,,Inc,1.172761917,Up,1,0
03-06-2015,Google says it can count calories in a picture,The apps that drain your phone's battery the most,Yahoo wins rights to live-stream an NFL game this October,Stocks: 6 things to know before the open,Just how much lobbying is Google doing? Investors want to know,,,,,,,,Same,0.074091056,Up,1,0
04-06-2015,Can Golden State's Stephen Curry be an ad star like LeBron?,China censors money transfers on Tiananmen anniversary,Ray Kurzweil: Humans will be hybrids by 2030,Stephen Colbert launches 'Late Show' online push,,,,,,,,,Same,-0.197113579,Down,0,1
05-06-2015,Apple is having its Microsoft moment,What will Apple announce on Monday? Six WWDC rumors,Zuckerberg announces Facebook Lite app,,,,,,,,,,Dec,-0.563057544,Down,0,1
08-06-2015,Apple updates iPhone & Mac software,Tim Cook: You'll soon see more women representing Apple,,,,,,,,,,,Dec,-1.2150496,Down,0,1
09-06-2015,Apple's 'News' app stokes fear among journalists,9 things you'll love about iOS 9,Apple Google  Microsoft and the race to look diverse,Apple finally opens up letting you test iOS 9,,,,,,,,,Same,-0.164909395,Down,0,1
10-06-2015,Elon Musk's plan to put the Internet in space moves to launch pad,The 10 most-loved CEOs are...,Pandora faces the music as Apple Spotify are big threats,Top employers for new grads in Europe,Intel wants to give millions to diverse startups,There's finally something awesome to do with Google Glass,How Google Glass can help people with Parkinson's,,,,,,Inc,1.384694198,Up,1,0
11-06-2015,Google wants to make your city better,App fills your calendar so you can pretend to be busy,Inside the world's most secretive VIP meeting,,,,,,,,,,Dec,-0.708548653,Down,0,1
12-06-2015,Netflix battles illegal streams of 'Orange is the New Black',YouTube will launch new gaming app later this summer,Net neutrality is here. What it means for you,Salesforce CEO: I didn't focus on hiring women then. But I am now,,,,,,,,,Same,0.137329013,Up,1,0
15-06-2015,Facebook's new app powered by artificial intelligence,,,,,,,,,,,,Same,-0.151512879,Down,0,1
16-06-2015,10 top MBA employers,Jeb Bush's campaign website contains a 'Die Hard' surprise,,,,,,,,,,,Same,-0.04731264,Down,0,1
17-06-2015,Nest's new security camera lets you watch your pets,Microsoft announces major executive shakeup,Millennials love these 10 ETF funds,,,,,,,,,,Same,-0.020776584,Down,0,1
18-06-2015,Nasdaq closes at record high,The world's smartphone makers are crazy about India,,,,,,,,,,,Inc,1.079092279,Up,1,0
19-06-2015,Google bans revenge porn,The Nasdaq just topped its dot-com record...thanks to these stocks,Silicon Valley's plan to be more diverse,Tech companies standing up to government data requests,Google makes its own phone safer - but exposes other Androids to hacks,,,,,,,,Same,-0.09680013,Down,0,1
22-06-2015,Next Apple Watch could have camera better WiFi,I survived college mania at America's most stressed-out high school,,,,,,,,,,,Same,-0.259460874,Down,0,1
23-06-2015,Sales spike for Confederate-themed flags and pins,Facebook now worth more than Walmart,Google Play Music is now free,Google testing a cardiac sensor wristband,Americans care way more about Uber than the crisis in Greece,Gmail now has an 'undo send' button,Banned by Amazon,My debit card has been hacked TWICE,Banks are skimping on website security,Don't ditch that BlackBerry yet!,,,Same,0.155652838,Up,1,0
24-06-2015,Google exec dies at Cannes Lions festival,The Simplifiers,The Idealists,The Futurists,The Nikkei just closed at its highest level in 18 years,World's Top Employers for New Grads,,,,,,,Dec,-0.399995,Down,0,1
25-06-2015,Google transforms old coal power plant into renewable-powered data center,Apple pulls Confederate flag-bearing Civil War games from App Store,Coca-Cola and Richard Branson team up in 'space race' against Elon Musk,,,,,,,,,,Dec,-0.675490384,Down,0,1
26-06-2015,Corporate America celebrates gay marriage decision,Self-driving cars from rivals Google  Delphi in close call,Techtiquette: Can I tell someone to 'Go Google it?',Parents of dead Google exec mourn 'tragic accident',,,,,,,,,Dec,-1.036743457,Down,0,1
29-06-2015,Global markets spooked by looming 'leap second',Are value stocks the next Brooklyn?,,,,,,,,,,,Dec,-0.664747325,Down,0,1
30-06-2015,The Internet survived the leap second,Apple Music suffers snafu during debut,The new Microsoft Edge browser logo looks like...,Apple Music is here: 5 things to know,,,,,,,,,Dec,-1.04749055,Down,0,1
01-07-2015,20 ways to make your Chrome browser so much better,MasterCard will approve purchases by scanning your face,Emojis are coming to Gmail!,,,,,,,,,,Dec,-0.550750502,Down,0,1
02-07-2015,Revenge porn hacker pleads guilty faces 7 years,,,,,,,,,,,,Inc,0.445230468,Up,1,0
06-07-2015,Google tests new ride-sharing app,5 things that count more than an Ivy League college degree,,,,,,,,,,,Inc,0.646772859,Up,1,0
07-07-2015,Bargain hunting in the Chinese stock rubble,,,,,,,,,,,,Inc,0.361289733,Up,1,0
09-07-2015,More bad news for stocks: Earnings may stink,Popular Android game stole Facebook logins,YouTube star PewDiePie shrugs off his salary critics,,,,,,,,,,Dec,-0.466432563,Down,0,1
10-07-2015,Has Apple peaked?,,,,,,,,,,,,Inc,0.729640913,Up,1,0
13-07-2015,Facebook is trying to be the next YouTube,,,,,,,,,,,,Inc,2.565302295,Up,1,0
14-07-2015,Facebook may release Siri-like virtual assistant,Twitter shares soar on phony Bloomberg story,Google Photos syncs files even after you delete app,,,,,,,,,,Inc,2.622716683,Up,1,0
15-07-2015,I'm a lesbian. Now will you fund my startup?,Netflix stock just got 'cheaper.' Will you buy?,Comcast's super fast Internet costs $300 a month,,,,,,,,,,Same,0.016061628,Up,1,0
16-07-2015,Hackers score 1 million miles for helping United find security bugs,Facebook is taking on Amazon with shopping pages,The iPod is outperforming the Apple Watch,Europe launches probe into Qualcomm,Stocks: 5 things to know before the open,,,,,,,,Inc,2.606522709,Up,1,0
17-07-2015,Google wows. Will Apple Amazon and Facebook follow?,Why you need to own the Four Horsemen of Tech,Injuries in Google self-driving car accident,Stocks: 5 things to know before the open,Google shares soar 13%,,,,,,,,Inc,3.687210015,Up,1,0
20-07-2015,Airbnb streamlining business travel,Elon Musk co-founded this hot new tech stock,6 biggest threats to the stock market,,,,,,,,,,Inc,0.573392097,Up,1,0
21-07-2015,IBM has been dead money in Ginni Rometty era,How to look like a million bucks on a Millennial's budget,,,,,,,,,,,Inc,1.082090591,Up,1,0
22-07-2015,Apple has $203 billion in cash. Why?,Why Swift may have to tailor her 1989 tour for China,Apple's iPhone suppliers are getting crushed,Google reveals your location history in Maps,Google still offers most coveted jobs in Asia,Microsoft posts massive loss but there are signs of hope,,,,,,,Same,0.183080539,Up,1,0
23-07-2015,Google could let you record share and replay your memories,Europe opens antitrust probe into Hollywood studios and Sky TV,,,,,,,,,,,Dec,-2.569297032,Down,0,1
24-07-2015,Gmail messages can now self-destruct,Apple pulls the Google Nest smart thermostat from its shelves,Amazon built the Star Trek computer for your house,YouTube redesigns app; priority is 'mobile mobile and mobile',Anime nerds trying to Google bomb ISIS,,,,,,,,Dec,-3.622875116,Down,0,1
27-07-2015,When will Twitter name a new CEO?,Google + is getting dismantled,Android phones can be hacked with a simple text,China eliminates all restrictions on gaming consoles,,,,,,,,,Inc,1.00805314,Up,1,0
28-07-2015,The best Android smartphone gets better,Investors wait for the 'Big One.' No correction in 4 years!,Ask the wrong question and Google Now will tell you off,LG unveils a 'smart' new flip phone,Which is the best digital assistant: Siri Cortana Alexa or Google Now?,Elon Musk and Stephen Hawking warn over 'killer robots',,,,,,,Dec,-0.763240818,Down,0,1
29-07-2015,The secret to winning a presidential campaign,Is Yelp on its death bed?,Are Tom Brady's texts really gone forever?,Google Maps will help you avoid waiting in line,The man who designed Windows 10,,,,,,,,Inc,0.497774342,Up,1,0
30-07-2015,Google Street View cars will soon measure pollution,,,,,,,,,,,,Inc,0.411115397,Up,1,0
31-07-2015,Exxon and Chevron profits are down over 50%,How to make Chrome your default Windows 10 browser,Congressional Black Caucus to talk diversity with Silicon Valley leaders,Why Mozilla calls this Windows 10 feature 'very disturbing',IOS 9 makes the iPhone a smarter smartphone,Pinterest is testing ways to fix diversity,,,,,,,Dec,-0.913874363,Down,0,1
03-08-2015,Bus drivers for Apple Yahoo demand $27.50 an hour,12 things you didn't know you could do with Gmail,Uber's biggest problem is ...,America's 12 biggest companies now,German automakers buy Nokia maps unit for $3.1 billion,,,,,,,,Inc,0.938688513,Up,1,0
04-08-2015,Windows 10 Mobile needs more apps to be worthy,Why Apple stock has plunged 15% from its all-time high,How Google designs for the blind,Intel doubles bonuses for referring women and minorities,Watch out for these serious Mac attacks,,,,,,,,Same,0.132079982,Up,1,0
