06-09-2002,Stock picks by the pros,Stocks stumble to a close,U.S. service sector slows again,The end of the consumer?,Big gains for the Big Three?,Retail sales: yikes or yawn?,Retailers under pressure,,,,,,Inc,2.286823732,Up,1,0
09-09-2002,BJ's Wholesale CEO resigns,Wal-Mart reaffirms sales outlook,,,,,,,,,,,Inc,1.196575453,Up,1,0
10-09-2002,Retail sales get a lift,,,,,,,,,,,,Inc,2.106238505,Up,1,0
11-09-2002,Hot Stocks: Tyco boosted,Goodbye cocoon boom?,LatAm drifts higher,Markets hold on,Stocks muster a rally,,,,,,,,Dec,-2.166066709,Down,0,1
12-09-2002,Markets are all ears,,,,,,,,,,,,Dec,-1.992623579,Down,0,1
13-09-2002,Retail sales show surprising strength,Consumer sentiment dips,,,,,,,,,,,Inc,2.409644247,Up,1,0
18-09-2002,A blue-chip burnout,,,,,,,,,,,,Inc,1.360669101,Up,1,0
23-09-2002,Retailers see slower sales,,,,,,,,,,,,Dec,-2.048422681,Down,0,1
24-09-2002,Don't rule out a rate cut,Retail sales down,Could it actually get worse?,Wal-Mart wannabes,Stocks spring another leak,,,,,,,,Dec,-0.789980702,Down,0,1
30-09-2002,Hot Stocks: EMS Tech,Stock slide steepens,3Q to end sharply lower,,,,,,,,,,Dec,-3.921947317,Down,0,1
01-10-2002,Stocks primed to rise,September sellout for stocks,Q3 strikes out,Traders run for the hills,,,,,,,,,Inc,5.016240657,Up,1,0
02-10-2002,Not bad for October,Stock gains for 2002? Dream on,,,,,,,,,,,Dec,-0.75420423,Down,0,1
04-10-2002,LatAm stocks end higher,,,,,,,,,,,,Inc,1.252199154,Up,1,0
07-10-2002,Sears warns on 3Q,,,,,,,,,,,,Dec,-1.660162077,Down,0,1
08-10-2002,Port lockout a mess for retailers,Send in the Dramamine,,,,,,,,,,,Inc,3.238463136,Up,1,0
09-10-2002,Market corrections,Judge orders ports opened,Stocks make a go of it,Bush steps in market steps up,,,,,,,,,Dec,-3.554455359,Down,0,1
10-10-2002,Hot Stocks: Yucky Yum!,Big retailers had disappointing month,Techs to the rescue,Blue chips continue descent,Stocks get mixed signals,The Dow's deep dive,,,,,,,Inc,1.753692611,Up,1,0
11-10-2002,Stock picks by the pros,Retail sales fall,The bulls have their day,Fool me once...,,,,,,,,,Inc,4.220716197,Up,1,0
15-10-2002,Rally on hold,,,,,,,,,,,,Inc,1.533192668,Up,1,0
16-10-2002,Will consumers play Grinch?,The rally continues,,,,,,,,,,,Inc,0.834956461,Up,1,0
21-10-2002,Kmart loses $176M in September,Retailers not spooked by Halloween,,,,,,,,,,,Same,0.195418366,Up,1,0
22-10-2002,Retailers not spooked by Halloween,,,,,,,,,,,,Dec,-0.549551498,Down,0,1
25-10-2002,Is that it for Tyco's run?,,,,,,,,,,,,Inc,1.504961048,Up,1,0
28-10-2002,Penney ups 3Q forecast,,,,,,,,,,,,Dec,-2.368100296,Down,0,1
30-10-2002,Wal-Mart frowns on Dow,Stock futures perk up,Blue chips put up a fight,Retailers' holiday confidence shaken,,,,,,,,,Dec,-2.341624614,Down,0,1
31-10-2002,Stocks: Bring on the data,Sandy Sallie and Spitzer,,,,,,,,,,,Same,0,Down,0,1
01-11-2002,Target tests N.Y. waters,,,,,,,,,,,,Inc,1.791377123,Up,1,0
05-11-2002,Retailers' coal is investors' gold,Stock rally in transit,,,,,,,,,,,Inc,1.795733292,Up,1,0
07-11-2002,Retailers: Wal-Mart up 3.7%,Wal-Mart sales gain slows,,,,,,,,,,,Dec,-0.643970585,Down,0,1
08-11-2002,Retailers' 3Q results on tap,,,,,,,,,,,,Same,0.055553704,Up,1,0
11-11-2002,Federated cuts sales forecast,Rally on hold,,,,,,,,,,,Dec,-1.924502185,Down,0,1
12-11-2002,Stocks get battered,,,,,,,,,,,,Inc,0.466417928,Up,1,0
13-11-2002,Wal-Mart tops 3Q profit target,Roundup: Wal-Mart 3Q up 24%,Greenspan in focus,Stocks snap losing streak,Stocks to watch Wednesday,,,,,,,,Inc,2.079463385,Up,1,0
14-11-2002,Choppy day on Wall Street,,,,,,,,,,,,Inc,0.944597656,Up,1,0
18-11-2002,Is Wal-Mart the next PC powerhouse?,Expect fewer elves,Kmart touts holiday hopes,Retailers see sluggish sales,Toys 'R' Us tops estimates,All eyes on Iraq UAL,,,,,,,Dec,-2.841628959,Down,0,1
19-11-2002,Stocks step back,Wall Street takes a breather,,,,,,,,,,,Dec,-1.434160951,Down,0,1
20-11-2002,Media to tech: Stop stealing!,,,,,,,,,,,,Inc,2.544774789,Up,1,0
22-11-2002,A fund that rules the world,A fund on a 3-year hot streak,,,,,,,,,,,Dec,-0.370646782,Down,0,1
25-11-2002,Blue Xmas for PCs,Back in black,Retailers reiterate sales forecasts,,,,,,,,,,Inc,0.69223385,Up,1,0
26-11-2002,...and a DVD in a pear tree,4 ways to play the war,Back in black,,,,,,,,,,Same,-0.299625457,Down,0,1
27-11-2002,True blue,Not blue,,,,,,,,,,,Inc,2.985915493,Up,1,0
29-11-2002,Deck the malls,FAO warns on sales earnings,,,,,,,,,,,Dec,-1.534526798,Down,0,1
02-12-2002,Shoppers swarm stores,Hot stocks: Potash in pain,Dow pulls off its highs,Stocks rise on Intel sales,Stocks smell a rally,,,,,,,,Dec,-2.823441795,Down,0,1
03-12-2002,A little confidence please...,Blue chips hit a bump,Markets begin December mixed,No bargains here,,,,,,,,,Dec,-0.827511938,Down,0,1
04-12-2002,Cost-cutting boosts retailers,,,,,,,,,,,,Inc,1.001849685,Up,1,0
05-12-2002,Discount chains lose ground,Stocks eye higher open,,,,,,,,,,,Dec,-2.608374405,Down,0,1
06-12-2002,Bulls retreat,The Gap is back...but not on sale.,,,,,,,,,,,Inc,0.549764929,Up,1,0
09-12-2002,Hot stocks: Skeched out,,,,,,,,,,,,Dec,-2.243595357,Down,0,1
10-12-2002,Bears on a tear,The sell-off continues,,,,,,,,,,,Inc,1.214811006,Up,1,0
11-12-2002,Spot shortages of holiday goods seen,,,,,,,,,,,,Inc,0.386102324,Up,1,0
16-12-2002,Zero is the loneliest number for retail,Hot toys hard to find,Retail's holiday blahs,,,,,,,,,,Inc,2.749752774,Up,1,0
17-12-2002,FAO's 3Q bleak,,,,,,,,,,,,Dec,-1.75506082,Down,0,1
18-12-2002,Microsoft Xbox sales spike,Brazil inches higher,,,,,,,,,,,Dec,-1.118743845,Down,0,1
19-12-2002,Bankruptcy: The good the bad,,,,,,,,,,,,Same,0.059842409,Up,1,0
23-12-2002,Tough times in toyland,Stocks turn mixed,Stocks focused on retail oil,,,,,,,,,,Dec,-1.860279079,Down,0,1
24-12-2002,Tough times in toyland,Blue Christmas for retailers,Mixed Monday for stocks,No holiday cheer for blue chips,Little cheer for stores,,,,,,,,Inc,0.8113631,Up,1,0
26-12-2002,Stocks make a U-turn,Stocks open higher,Investors mull Wal-Mart  jobs,Wall St. scrutinizes retail,,,,,,,,,Inc,1.035528934,Up,1,0
27-12-2002,Bulls seeking a home,Brutal Christmas for stores,Stocks can't hold on,,,,,,,,,,Dec,-0.747020003,Down,0,1
30-12-2002,Retailers report weak sales,Stocks march higher,,,,,,,,,,,Inc,3.010575671,Up,1,0
31-12-2002,Late rush boosted holiday sales,Dow gains Nasdaq lame,,,,,,,,,,,Same,-0.17786562,Down,0,1
07-01-2003,Shoppers plug into the gadgets,,,,,,,,,,,,Same,0.278217409,Up,1,0
08-01-2003,Debit card suit charges ahead,,,,,,,,,,,,Dec,-0.813492031,Down,0,1
09-01-2003,Retail roundup: Wal-Mart,Sales stunk. So what?,,,,,,,,,,,Inc,2.305414778,Up,1,0
10-01-2003,Rarin' to rally,Retail rally,,,,,,,,,,,Dec,-0.577810115,Down,0,1
14-01-2003,Retailers see no gains from pain,,,,,,,,,,,,Inc,0.803921569,Up,1,0
15-01-2003,Chips are up at Intel,Kmart cutting up to 350,,,,,,,,,,,Dec,-1.671527664,Down,0,1
23-01-2003,Down for the year,,,,,,,,,,,,Inc,1.040149782,Up,1,0
31-01-2003,Roundup: Disney profit falls,,,,,,,,,,,,Inc,1.271182176,Up,1,0
05-02-2003,Store chains get hot catering to teens,,,,,,,,,,,,Dec,-1.806714362,Down,0,1
06-02-2003,January sales uninspiring,Retail roundup: Wal-Mart rises,Stocks mixed at open,Headed down again,,,,,,,,,Dec,-3.525771134,Down,0,1
07-02-2003,Earnings: EDS Pixar Callaway,Split day for markets,Jobs could lead stocks,,,,,,,,,,Dec,-1.494734737,Down,0,1
10-02-2003,More Web shoppers may get taxed,,,,,,,,,,,,Inc,0.470087617,Up,1,0
11-02-2003,Earnings roundup: Blockbuster miss,,,,,,,,,,,,Same,0.212084827,Up,1,0
12-02-2003,U.S. stuck on duct,Online taxes: It's inevitable,,,,,,,,,,,Inc,0.906790422,Up,1,0
14-02-2003,Retail: Who's hot who's not,,,,,,,,,,,,Inc,3.169611737,Up,1,0
18-02-2003,Stocks jump at open,Traders dig out & dig in,,,,,,,,,,,Dec,-1.148036208,Down,0,1
19-02-2003,The market digs out,Gains of New York,Wal-Mart tops forecasts,,,,,,,,,,Dec,-0.61137151,Down,0,1
20-02-2003,Earnings roundup: Target hits,,,,,,,,,,,,Dec,-1.414800082,Down,0,1
21-02-2003,Stock picks by the pros,,,,,,,,,,,,Inc,0.928794614,Up,1,0
24-02-2003,Storm hits Federated Penney sales,,,,,,,,,,,,Dec,-2.176595438,Down,0,1
25-02-2003,Home Depot posts lower profit,Sears gets new credit line,Investors jittery about Iraq,Ahold shares tumble,,,,,,,,,Inc,2.432320271,Up,1,0
28-02-2003,Stock picks by the pros,Gates Buffett top list of billionaires,,,,,,,,,,,Dec,-0.496890279,Down,0,1
04-03-2003,Earnings roundup: EchoStar,,,,,,,,,,,,Dec,-2.2916625,Down,0,1
05-03-2003,Toys 'R' Us beats target,Toys 'R' Us: 3 things,,,,,,,,,,,Inc,2.067791516,Up,1,0
06-03-2003,February retail sales snowed in,Job report spooks stocks,Retail roundup: Wal-Mart,Jobless claim jitters,,,,,,,,,Same,-0.105371968,Down,0,1
07-03-2003,California here comes Kohl's,,,,,,,,,,,,Inc,2.60127281,Up,1,0
12-03-2003,Shopping for survival gear,,,,,,,,,,,,Inc,1.47404184,Up,1,0
13-03-2003,Saved by the bell,,,,,,,,,,,,Inc,2.164946392,Up,1,0
14-03-2003,What war? Pass the pansies please,Stocks have biggest gain in five months,,,,,,,,,,,Same,-0.282826263,Down,0,1
17-03-2003,Stocks rally as war nears,,,,,,,,,,,,Inc,4.98990101,Up,1,0
18-03-2003,War drums spark a rally,,,,,,,,,,,,Inc,1.044287392,Up,1,0
27-03-2003,Internet mania returns!,The Street gets back to selling,,,,,,,,,,,Inc,1.018869811,Up,1,0
31-03-2003,Kmart cuts 523 jobs,Fortune: Wal-Mart on top,,,,,,,,,,,Inc,0.696731206,Up,1,0
01-04-2003,A fitting close to a wild quarter,,,,,,,,,,,,Inc,0.614203478,Up,1,0
02-04-2003,Circuit City 4Q profit drops,,,,,,,,,,,,Inc,1.961155986,Up,1,0
03-04-2003,The future of flight,,,,,,,,,,,,Inc,0.464684024,Up,1,0
07-04-2003,Corporate America's war effort,Is supply-chain software the next CRM?,,,,,,,,,,,Dec,-2.495061973,Down,0,1
10-04-2003,Forget the Easter bunny surf's up,The real recovery,Retail roundup: Wal-Mart  Gap Inc.,Stocks inch up then down,,,,,,,,,Inc,1.942474749,Up,1,0
11-04-2003,Street Talk: Wal-Mart cut,Stocks see through worry,,,,,,,,,,,Dec,-2.070236675,Down,0,1
16-04-2003,Kmart's outlook still murky,,,,,,,,,,,,Dec,-1.356483969,Down,0,1
17-04-2003,Diet guru Atkins dies,,,,,,,,,,,,Inc,1.595157653,Up,1,0
21-04-2003,The virtual solution to SARS,,,,,,,,,,,,Dec,-0.793933627,Down,0,1
23-04-2003,Kmart bankruptcy plan OKd,,,,,,,,,,,,Inc,1.04692776,Up,1,0
24-04-2003,Designers: Such a deal!,,,,,,,,,,,,Dec,-1.554124687,Down,0,1
25-04-2003,Amazon grace,LeapFrog's fast rise,,,,,,,,,,,Same,-0.199602609,Down,0,1
29-04-2003,Stocks await confidence,MasterCard settles debit suit,,,,,,,,,,,Inc,0.873599572,Up,1,0
01-05-2003,Stocks look to weak open,,,,,,,,,,,,Dec,-0.674717685,Down,0,1
06-05-2003,Wal-Mart banishes bawdy mags,,,,,,,,,,,,Inc,0.593735135,Up,1,0
07-05-2003,Fed day yields gains,,,,,,,,,,,,Dec,-1.48452513,Down,0,1
08-05-2003,Retail uptick? Maybe May,Stocks point lower,Wal-Mart sales below forecast,Cisco selloff,,,,,,,,,Inc,0.695583,Up,1,0
09-05-2003,Stocks fall post-rally,Stocks stumble out of the gate,,,,,,,,,,,Inc,0.63119566,Up,1,0
12-05-2003,Stocks seeking direction,,,,,,,,,,,,Inc,1.777063396,Up,1,0
13-05-2003,Department stores suffer the blahs,Wal-Mart profits up Penney pinched,Stocks move down,,,,,,,,,,Dec,-0.484210921,Down,0,1
14-05-2003,Stocks may nose ahead,Rally takes a rest,Wal-Mart wobbles,,,,,,,,,,Dec,-3.543305234,Down,0,1
15-05-2003,Target misses target,,,,,,,,,,,,Same,-0.167130925,Down,0,1
16-05-2003,Wal-Mart drops Gifford line,,,,,,,,,,,,Dec,-0.338983064,Down,0,1
20-05-2003,New York Post cites plagiarism,Triple-digit losses,,,,,,,,,,,Inc,0.628812881,Up,1,0
21-05-2003,No running away of the bulls,Home Depot tops forecasts,The dollar's direct effect,,,,,,,,,,Dec,-0.397725386,Down,0,1
27-05-2003,Tech matters. So what?,Stocks face mighty euro,,,,,,,,,,,Inc,0.961538462,Up,1,0
28-05-2003,Wall Street hits highs,,,,,,,,,,,,Inc,1.425855568,Up,1,0
30-05-2003,Success on the cheap,,,,,,,,,,,,Same,-0.18971353,Down,0,1
03-06-2003,Modest uptick in retail sales,,,,,,,,,,,,Inc,0.341750535,Up,1,0
04-06-2003,Wal-Mart : Beyond the cheers,Hot water for Martha Stewart and IBM,,,,,,,,,,,Inc,1.680196306,Up,1,0
05-06-2003,Dow's view from 90,Discounters lose luster in May,Stocks tip lower,Wal-Mart sales gain slows,,,,,,,,,Inc,2.862525532,Up,1,0
06-06-2003,Stocks show strength,,,,,,,,,,,,Dec,-2.438136871,Down,0,1
19-06-2003,Stock picks by the pros,,,,,,,,,,,,Dec,-1.375561991,Down,0,1
24-06-2003,Kmart: Red light blue light?,,,,,,,,,,,,Inc,1.111107407,Up,1,0
25-06-2003,Markets mixed ahead of Fed,Stocks mixed pre-Fed,Halfway to Christmas,Fed AMD keep lid on techs,,,,,,,,,Dec,-1.04109589,Down,0,1
27-06-2003,Finally the heat is on!,,,,,,,,,,,,Dec,-1.284405505,Down,0,1
30-06-2003,Netflix a division of Wal-Mart ?,,,,,,,,,,,,Dec,-0.611114815,Down,0,1
01-07-2003,Dow's best quarter in years,,,,,,,,,,,,Inc,1.588781308,Up,1,0
02-07-2003,Stocks rise at open,Wal-Mart bars anti-gay bias,Stocks seek momentum,,,,,,,,,,Inc,1.771369678,Up,1,0
03-07-2003,Almost a bull,Stock surge,Sunny day on Wall Street,,,,,,,,,,Dec,-0.972974775,Down,0,1
08-07-2003,Sears dukes it out with Lowe's,,,,,,,,,,,,Inc,0.353984071,Up,1,0
10-07-2003,Wal-Mart hits target; others lag,,,,,,,,,,,,Inc,0.724245881,Up,1,0
11-07-2003,Yikes Yahoo!,,,,,,,,,,,,Inc,1.399101345,Up,1,0
15-07-2003,Retailers hungry for rebates,,,,,,,,,,,,Inc,0.42045899,Up,1,0
17-07-2003,Sears: A Wal-Mart wannabe?,Sears: now the test comes,,,,,,,,,,,Dec,-1.413425845,Down,0,1
21-07-2003,Liquidators get fat on leftovers,,,,,,,,,,,,Dec,-1.565521603,Down,0,1
25-07-2003,eBay pays $10M to settle PayPal case,,,,,,,,,,,,Inc,1.206770533,Up,1,0
28-07-2003,Wal-Mart on track for July,,,,,,,,,,,,Same,-0.053388504,Down,0,1
30-07-2003,Fuzzy math for Internet stocks,Nudity takes off,,,,,,,,,,,Same,0.269061883,Up,1,0
31-07-2003,Cisco needs to be top (line) heavy,A drag on growth,,,,,,,,,,,Dec,-0.604444444,Down,0,1
01-08-2003,The rally that wasn't,,,,,,,,,,,,Dec,-0.807611256,Down,0,1
04-08-2003,Will Thalia heat up Kmart sales?,Designers landing duds,,,,,,,,,,,Inc,1.916763452,Up,1,0
07-08-2003,Juicy July for retail sales,Stocks look to open weak,,,,,,,,,,,Inc,0.920679887,Up,1,0
08-08-2003,Go Wal-Mart ! Go blue chips!,,,,,,,,,,,,Inc,0.785066294,Up,1,0
11-08-2003,Stocks cautious near open,,,,,,,,,,,,Dec,-0.310988246,Down,0,1
13-08-2003,Netflix's secret weapon,Stocks flat at open,Futures gain on retail sales,Wal-Mart hits raised target,Fed decision aids stocks,Stocks to watch Wednesday,,,,,,,Dec,-0.735042735,Down,0,1
14-08-2003,Banking on back to school,What's with all the negativity?,Wall Street tripped up,,,,,,,,,,Same,-0.241088342,Down,0,1
19-08-2003,Home Depot 2Q income up,Wall Street surges,Wall Street's charged up,,,,,,,,,,Same,-0.287888235,Down,0,1
25-08-2003,Stocks flounder at open,Back-to-school boosts Wal-Mart,,,,,,,,,,,Inc,1.198623247,Up,1,0
26-08-2003,Shampoo drumsticks and fill 'er up,Stocks sag,Stocks' bitter end,,,,,,,,,,Inc,0.629998297,Up,1,0
28-08-2003,Sears rejiggers again,,,,,,,,,,,,Same,0.084386498,Up,1,0
02-09-2003,Amazon's run isn't over,,,,,,,,,,,,Inc,1.628220855,Up,1,0
04-09-2003,Retail forecast: A brighter Christmas,August retail sales get high marks,Stocks cautious at open,Test for Wall Street,,,,,,,,,Same,0.049963365,Up,1,0
05-09-2003,Jobs loss dents stocks,Jobs worry stocks,Stocks to watch Friday,Stocks stay upbeat,,,,,,,,,Dec,-0.355328269,Down,0,1
08-09-2003,Stocks edge up at open,Wall St. set for flat start,,,,,,,,,,,Same,0.068319386,Up,1,0
09-09-2003,Rally on a roll,,,,,,,,,,,,Dec,-2.578109954,Down,0,1
11-09-2003,Striving to feel safe,,,,,,,,,,,,Inc,0.700528921,Up,1,0
12-09-2003,Needed: Rx for Eckerd,,,,,,,,,,,,Inc,0.524658972,Up,1,0
15-09-2003,Playboy wants Wal-Mart women,Dell: Meanest kid on the block,,,,,,,,,,,Inc,0.434782609,Up,1,0
16-09-2003,Techs continue retreat,,,,,,,,,,,,Inc,0.776258396,Up,1,0
19-09-2003,America's rich get richer,,,,,,,,,,,,Inc,1.042749374,Up,1,0
23-09-2003,Weak dollar dents the Dow,,,,,,,,,,,,Inc,0.576013256,Up,1,0
24-09-2003,Sharper Image: Not so picture perfect,,,,,,,,,,,,Dec,-1.048587888,Down,0,1
25-09-2003,Tupperware house party in trouble,,,,,,,,,,,,Inc,0.530127231,Up,1,0
26-09-2003,Sears stokes online sales,,,,,,,,,,,,Same,0.176363313,Up,1,0
29-09-2003,Carly most powerful woman - again,,,,,,,,,,,,Same,-0.069844596,Down,0,1
30-09-2003,Wal-Mart to tighten tobacco sales,,,,,,,,,,,,Dec,-1.81083506,Down,0,1
03-10-2003,Stocks hold on,,,,,,,,,,,,Dec,-0.811045715,Down,0,1
08-10-2003,Wednesday's stocks: Retailers,,,,,,,,,,,,Dec,-0.813559322,Down,0,1
09-10-2003,September retail sales jump,Stocks surge at open,Thursday's stocks: Wal-Mart,,,,,,,,,,Dec,-0.371748902,Down,0,1
10-10-2003,What's cooking at Conn's?,Levi '01 Income Overstated 3Q Incorrect,Stocks keep it together,The humdinger that wasn't,,,,,,,,,Same,-0.051331051,Down,0,1
13-10-2003,The $49000 hip and other oddities,Why drugs cost so much,Awaiting the flood,Wal-Mart on track for October,Good now is not enough,,,,,,,,Inc,0.889955502,Up,1,0
17-10-2003,The market takes a breather,,,,,,,,,,,,Dec,-1.275164472,Down,0,1
21-10-2003,Got $672 for the holidays?,,,,,,,,,,,,Same,0.203913346,Up,1,0
23-10-2003,The store of the future,,,,,,,,,,,,Inc,0.945827998,Up,1,0
24-10-2003,Wall Street wobbles,250 arrested at Wal-Mart,,,,,,,,,,,Dec,-1.021969018,Down,0,1
28-10-2003,Millionaire in the making,,,,,,,,,,,,Inc,1.678485868,Up,1,0
30-10-2003,Walmart.com looking to stir things up,Gift cards: Charged for the holidays,,,,,,,,,,,Same,-0.084960071,Down,0,1
31-10-2003,From silver screen to Halloween,No market jolt from GDP surprise,,,,,,,,,,,Same,0.255105447,Up,1,0
03-11-2003,Funds you can trust,,,,,,,,,,,,Inc,0.459419772,Up,1,0
06-11-2003,Retailers' nightmare before Christmas,Visa Needed Banks Help on Cash Crunch,Bulls could be rerouted,,,,,,,,,,Inc,1.191303563,Up,1,0
07-11-2003,What's not to like?,Up day for Wall Street,,,,,,,,,,,Dec,-0.561705532,Down,0,1
10-11-2003,Illegal workers sue Wal-Mart,Stocks under pressure?,,,,,,,,,,,Dec,-0.394171393,Down,0,1
12-11-2003,Stocks wait for numbers,,,,,,,,,,,,Dec,-0.549073448,Down,0,1
13-11-2003,The Wal-Mart effect,Wal-Mart signals caution,Stocks dip at open,Stock futures turn lower,Stock rally reloaded,Stocks to watch Thursday,Investors rush in,Playboy undresses Wal-Mart women,,,,,Dec,-1.472933504,Down,0,1
14-11-2003,The Wal-Mart effect,The cool-down lap,Hello Kitty's a whisker away from 30,Michigan sentiment index jumps,Stocks edge higher,Wal-Mart Sneezes,Wall Street wobbles,,,,,,Dec,-0.936599424,Down,0,1
18-11-2003,Blue chips: The next generation,Home improvement,,,,,,,,,,,Dec,-0.527171443,Down,0,1
19-11-2003,Made in China,Wal-Mart kicks off toy price war,If three is a hat trick...,,,,,,,,,,Inc,1.11721799,Up,1,0
25-11-2003,Digital music's path to profitability,Stock picks by the pros,,,,,,,,,,,Same,0.071430357,Up,1,0
26-11-2003,Snuff games and ratings,,,,,,,,,,,,Dec,-0.571222778,Down,0,1
28-11-2003,Bargains not such bargains,Soggy start for shoppers,Get ready for Black Friday,Wall St. at the mall,,,,,,,,,Same,0.071944247,Up,1,0
01-12-2003,The Atkins effect,Stocks surge at open,Check it out Wall St!,Strong start to shopping season,,,,,,,,,Dec,-2.048883933,Down,0,1
02-12-2003,Holiday shoppers hit the stores,Holiday cheer,Market rallies anew,,,,,,,,,,Dec,-2.411194463,Down,0,1
03-12-2003,Wal-Mart to limit MasterCard use,Stock rally rests,,,,,,,,,,,Dec,-1.125918538,Down,0,1
04-12-2003,Retailers still seek holiday cheer,Stocks take holiday's pulse,Nasdaq can't hang on to 2000 mark,,,,,,,,,,Same,-0.225816715,Down,0,1
05-12-2003,The storm that killed Christmas?,Stocks take a holiday,Dollar bonds edge up,,,,,,,,,,Inc,1.19205681,Up,1,0
09-12-2003,Want the game? Show some ID.,,,,,,,,,,,,Dec,-1.663549533,Down,0,1
16-12-2003,So much for a 'Saddam Is captured' rally,Saddam can't help stocks,,,,,,,,,,,Inc,0.764703922,Up,1,0
17-12-2003,We found the rally!,,,,,,,,,,,,Inc,1.149875246,Up,1,0
18-12-2003,Stocks turn higher,Wal-Mart to test digital music service,,,,,,,,,,,Dec,-0.54830971,Down,0,1
19-12-2003,Bobbleheads,Stock rally reloads,Ho! Ho! Ho!,,,,,,,,,,Dec,-0.645285645,Down,0,1
22-12-2003,Too little too late?,A big change at Wal-Mart ?,Stocks in choppy trade,Toy wars injure KB,,,,,,,,,Inc,1.861808133,Up,1,0
23-12-2003,Personal spending edges up,A second look at retail,Dow S&P hit new highs,,,,,,,,,,Same,-0.245750463,Down,0,1
26-12-2003,Stocks still partying,Stocks unwrap retailers,Stocks keep holiday mode,,,,,,,,,,Inc,0.382262997,Up,1,0
29-12-2003,Best of Street Life 2003,Predictions for 2004,Beef retail in stock focus,,,,,,,,,,Inc,0.41761959,Up,1,0
30-12-2003,2003's biggest losers,,,,,,,,,,,,Dec,-0.321061373,Down,0,1
31-12-2003,2004: Three things to watch,A Christmas letdown,,,,,,,,,,,Same,0.188853632,Up,1,0
02-01-2004,Did shoppers come through?,,,,,,,,,,,,Dec,-1.968133157,Down,0,1
07-01-2004,Sweet music for Apple,Techs fight back,,,,,,,,,,,Same,0.262467192,Up,1,0
08-01-2004,The dollar's direct effect,Twas a happy holiday for retail,Stocks check out retail,The protectionist portfolio,,,,,,,,,Dec,-1.625417466,Down,0,1
09-01-2004,Wal-Mart : No longer a home run?,,,,,,,,,,,,Dec,-1.411100605,Down,0,1
12-01-2004,Stocks eye higher open,Wal-Mart CEO talks of 'modest' '04,,,,,,,,,,,Same,-0.171102668,Down,0,1
13-01-2004,A world of wired stores,,,,,,,,,,,,Inc,0.706239754,Up,1,0
14-01-2004,Bankruptcy in store,,,,,,,,,,,,Inc,0.720244531,Up,1,0
22-01-2004,More song swappers sued,,,,,,,,,,,,Dec,-0.579551296,Down,0,1
26-01-2004,Netflix: feel-good hit,,,,,,,,,,,,Inc,0.719291761,Up,1,0
30-01-2004,GDP weaker than expected,,,,,,,,,,,,Dec,-0.737330876,Down,0,1
03-02-2004,Hot buys from Money magazine,Stocks to adore,,,,,,,,,,,Inc,0.585114291,Up,1,0
04-02-2004,Gateway: From cow town to Wayne's World,,,,,,,,,,,,Inc,0.80072428,Up,1,0
05-02-2004,Cold cash for retailers,Techs gain at open,,,,,,,,,,,Inc,0.734240688,Up,1,0
06-02-2004,Stocks edge higher,,,,,,,,,,,,Inc,1.911507965,Up,1,0
09-02-2004,Wal-Mart  Time Inc. in magazine deal?,,,,,,,,,,,,Inc,0.473270823,Up,1,0
17-02-2004,Deal-arama for Wall Street,,,,,,,,,,,,Same,0.243985705,Up,1,0
18-02-2004,Shopping for retailers,,,,,,,,,,,,Dec,-0.69443926,Down,0,1
19-02-2004,Stocks zoom at open,Dow sees decline,A boost from the numbers,Wal-Mart profits rise,Stocks to watch Thursday,,,,,,,,Inc,0.309278345,Up,1,0
20-02-2004,Stocks knocked lower,,,,,,,,,,,,Inc,1.24360986,Up,1,0
23-02-2004,Stuck on the iPod,Stocks edge higher,,,,,,,,,,,Inc,1.02624497,Up,1,0
25-02-2004,Wal-Mart tops most admired list,,,,,,,,,,,,Same,0.217574895,Up,1,0
04-03-2004,Stocks stall at open,Stocks mull jobs lost,,,,,,,,,,,Inc,0.394668634,Up,1,0
05-03-2004,Retailers enjoy a blowout month,Stocks to face tough Friday,"Prudential on Toys R Us: ""Buy"" now",,,,,,,,,,Dec,-0.921047713,Down,0,1
15-03-2004,More misery for Microsoft?,India: Retail magnet?,,,,,,,,,,,Same,-0.258392769,Down,0,1
22-03-2004,Miracle on 34th Street?,Stocks in worry mode,,,,,,,,,,,Dec,-0.343054894,Down,0,1
23-03-2004,3 safe havens,Fortune's most profitable,,,,,,,,,,,Same,0.085968019,Up,1,0
30-03-2004,Best Buy powers down,Wal-Mart takes on iTunes,,,,,,,,,,,Same,0.166941564,Up,1,0
02-04-2004,Size matters in California,Attention Kmart investors: It's a 'buy',,,,,,,,,,,Dec,-0.677969492,Down,0,1
06-04-2004,Size matters in California,,,,,,,,,,,,Inc,0.888888889,Up,1,0
07-04-2004,No smiles for Wal-Mart in California,Rolling out stocks,,,,,,,,,,,Dec,-1.226577492,Down,0,1
08-04-2004,March madness for retailers,,,,,,,,,,,,Dec,-2.241770918,Down,0,1
16-04-2004,Cheaper duds coming,,,,,,,,,,,,Inc,0.412367691,Up,1,0
19-04-2004,Earnings: 11 that matter 3 that don't,,,,,,,,,,,,Inc,0.63792931,Up,1,0
23-04-2004,Latest thing in pants: Spy Shorts,,,,,,,,,,,,Inc,1.270824317,Up,1,0
26-04-2004,Circuit City: No more excuses,Bass backwards?,Wal-Mart sees April softness,,,,,,,,,,Dec,-1.071977199,Down,0,1
30-04-2004,Small biz googly-eyed over Google,,,,,,,,,,,,Dec,-1.332871733,Down,0,1
03-05-2004,What Warren Buffett wants you to know,,,,,,,,,,,,Dec,-0.807015789,Down,0,1
06-05-2004,Mixed April in retailing,Six-figure jobs,,,,,,,,,,,Dec,-2.186374591,Down,0,1
07-05-2004,4 earnings reports that matter,Rate fears hit Wall Street,,,,,,,,,,,Dec,-0.991912215,Down,0,1
10-05-2004,Brace yourself Wall St.!,,,,,,,,,,,,Inc,3.21495514,Up,1,0
11-05-2004,Who has the cheapest video games?,,,,,,,,,,,,Dec,-1.249550865,Down,0,1
13-05-2004,Gas prices hitting SUV sales?,Stocks slip at open,Video games get raunchy,PPI sends futures down,Wal-Mart tops 1Q target,,,,,,,,Inc,0.345076274,Up,1,0
14-05-2004,Playboy seeks Home Depot women,,,,,,,,,,,,Dec,-0.433992775,Down,0,1
18-05-2004,Mac attack,,,,,,,,,,,,Same,0.290644874,Up,1,0
19-05-2004,The right reward card for you,,,,,,,,,,,,Dec,-1.510248139,Down,0,1
25-05-2004,Krispy Kreme: down for the carb count?,Wal-Mart shopping for subsidies?,,,,,,,,,,,Inc,1.185269876,Up,1,0
27-05-2004,Stocks pop at open,Oil lower=stocks up?,,,,,,,,,,,Inc,0.846848649,Up,1,0
28-05-2004,Choosing the right grill,Stocks lead as oil bleeds,,,,,,,,,,,Dec,-0.428802922,Down,0,1
03-06-2004,Retailers' pleasant May surprise,,,,,,,,,,,,Inc,0.98126496,Up,1,0
15-06-2004,Wall Street sees red,,,,,,,,,,,,Same,0.105908205,Up,1,0
18-06-2004,Shopping strip Beijing style,,,,,,,,,,,,Dec,-0.35829631,Down,0,1
21-06-2004,Stocks struggle at open,,,,,,,,,,,,Dec,-0.489132238,Down,0,1
22-06-2004,Stocks look for a lift,Stocks get dunked,,,,,,,,,,,Same,-0.203058896,Down,0,1
23-06-2004,Thank you Nasdaq,,,,,,,,,,,,Dec,-0.943399909,Down,0,1
24-06-2004,300000 baby strollers recalled,Wall St. awakens rallies,,,,,,,,,,,Dec,-0.802538231,Down,0,1
28-06-2004,Wal-Mart cuts June sales forecast,,,,,,,,,,,,Same,0.095399733,Up,1,0
29-06-2004,Discounters' summer doldrums,Best Buy: Dollars from digital,,,,,,,,,,,Dec,-0.440526727,Down,0,1
30-06-2004,Sears buying stores from Kmart,Stocks rise await Fed,,,,,,,,,,,Inc,0.767758187,Up,1,0
01-07-2004,Stocks up on day month quarter,,,,,,,,,,,,Dec,-2.523540585,Down,0,1
